

Run Date,Action,Symbol,Description,Type,Quantity,Price ($),Commission ($),Fees ($),Accrued Interest ($),Amount ($),Cash Balance ($),Settlement Date
12/20/2024,"DEBIT CARD PURCHASE SQ *PIZZA Annapolis MD1218242469216PJ2YYAY (Cash)",,"No Description",Cash,0.000,,,,,-13,306.83,
12/17/2024,"DEBIT CARD PURCHASE PIZZA HUT 37448 https://ipcha VA1215242494300PE38S5P (Cash)",,"No Description",Cash,0.000,,,,,-44.23,470.54,
09/13/2024,"DEBIT CARD PURCHASE PIZZA BOLI'S 703-335-2000 VA0910242476501LF2FSD0 (Cash)",,"No Description",Cash,0.000,,,,,-66.98,880.03,
08/26/2024,"DEBIT CARD PURCHASE PIZZA HUT 037448 https://ipcha VA0823242494300KX17FR1 (Cash)",,"No Description",Cash,0.000,,,,,-84.96,59.71,
07/08/2024,"DEBIT CARD PURCHASE PIZZA BOLI'S 703-335-2000 VA0705242476501JQ0KTSR (Cash)",,"No Description",Cash,0.000,,,,,-75.54,230.09,
06/17/2024,"DEBIT CARD PURCHASE PIZZA BOLI'S 703-335-2000 VA0613242476501HN039V8 (Cash)",,"No Description",Cash,0.000,,,,,-87.96,933.69,



"The data and information in this spreadsheet is provided to you solely for your use and is not for distribution. The spreadsheet is provided for"
"informational purposes only, and is not intended to provide advice, nor should it be construed as an offer to sell, a solicitation of an offer to buy or a"
"recommendation for any security or insurance product by Fidelity or any third party. Data and information shown is based on information known to Fidelity as of the date it was"
"exported and is subject to change. It should not be used in place of your account statements or trade confirmations and is not intended for tax reporting"
"purposes. For more information on the data included in this spreadsheet, including any limitations thereof, go to Fidelity.com."

"Brokerage services are provided by Fidelity Brokerage Services LLC (FBS), 900 Salem Street, Smithfield, RI 02917. Custody and other services provided by National"
"Financial Services LLC (NFS). Both are Fidelity Investment companies and members SIPC, NYSE. Insurance products at Fidelity are distributed by"
"Fidelity Insurance Agency, Inc., and, for certain products, by Fidelity Brokerage Services, Member NYSE, SIPC."

Date downloaded 07/30/2025 2:16 pm