

Run Date,Action,Symbol,Description,Type,Exchange Quantity,Exchange Currency,Quantity,Currency,Price,Exchange Rate,Commission,Fees,Accrued Interest,Amount,Cash Balance,Settlement Date
07/29/2025,"DEBIT CARD PURCHASE POS1 FOOD LION #138 MANASSAS VA07262524251316HF6JV8 (Cash)",,"No Description",Cash,0,,0.000,USD,,0,,,,-80.65,3948.23,
07/01/2025,"DEBIT CARD PURCHASE POS1 FOOD LION MANASSAS VA06282524251315MF6JVY (Cash)",,"No Description",Cash,0,,0.000,USD,,0,,,,-246.98,2836.25,
05/13/2025,"DEBIT CARD PURCHASE FOOD LION #1383 MANASSAS VA05112524692164334X85 (Cash)",,"No Description",Cash,0,,0.000,USD,,0,,,,-27.42,4028.47,
05/06/2025,"DEBIT CARD PURCHASE POS1 FOOD LION #138 MANASSAS VA05032524251313XF6JVD (Cash)",,"No Description",Cash,0,,0.000,USD,,0,,,,-22.25,786.93,
04/08/2025,"DEBIT CARD PURCHASE POS1 FOOD LION #138 MANASSAS VA040625242513131F6JW3 (Cash)",,"No Description",Cash,0,,0.000,USD,,0,,,,-3.21,407.79,
04/08/2025,"DEBIT CARD PURCHASE POS1 FOOD LION #138 MANASSAS VA040625242513131F6JW3 (Cash)",,"No Description",Cash,0,,0.000,USD,,0,,,,-44.29,420.20,
03/25/2025,"DEBIT CARD PURCHASE POS1 FOOD LION #138 MANASSAS VA03232524251312KF6JVY (Cash)",,"No Description",Cash,0,,0.000,USD,,0,,,,-53.55,1778.02,
03/04/2025,"DEBIT CARD PURCHASE POS1 FOOD LION #138 MANASSAS VA03012524251311YF6JVR (Cash)",,"No Description",Cash,0,,0.000,USD,,0,,,,-134.53,3271.40,
02/19/2025,"DEBIT CARD PURCHASE POS1 FOOD LION #138 MANASSAS VA02152524251311HF6JVL (Cash)",,"No Description",Cash,0,,0.000,USD,,0,,,,-40.74,3123.76,



"The data and information in this spreadsheet is provided to you solely for your use and is not for distribution. The spreadsheet is provided for"
"informational purposes only, and is not intended to provide advice, nor should it be construed as an offer to sell, a solicitation of an offer to buy or a"
"recommendation for any security or insurance product by Fidelity or any third party. Data and information shown is based on information known to Fidelity as of the date it was"
"exported and is subject to change. It should not be used in place of your account statements or trade confirmations and is not intended for tax reporting"
"purposes. For more information on the data included in this spreadsheet, including any limitations thereof, go to Fidelity.com."

"Brokerage services are provided by Fidelity Brokerage Services LLC (FBS), 900 Salem Street, Smithfield, RI 02917. Custody and other services provided by National"
"Financial Services LLC (NFS). Both are Fidelity Investment companies and members SIPC, NYSE. Insurance products at Fidelity are distributed by"
"Fidelity Insurance Agency, Inc., and, for certain products, by Fidelity Brokerage Services, Member NYSE, SIPC."

Date downloaded 08/02/2025 7:30 am